System,Primary_Focus,Semantic_Formalism,Ontology_Integration,Scale,Analytics_Methods,FAIR_Compliance,Representative_Paper,Full_Reference,Real_Title,DOI,Source,Category_Confidence
Microbe-Disease KG (2022),Microbe-Disease Associations,Partial RDF/OWL,Limited (Taxonomy/DOID only),~5K-20K nodes,"Association scoring, Pathway analysis",Low-Moderate,"Zou et al., 2022","L. Wang; H. Li; Y. Wang; Y. Tan; Z. Chen; T. Pei; Q. Zou. (2022). ""MDADP: A Webserver Integrating Database and Prediction Tools for Microbe-Disease Associations"". IEEE Journal of Biomedical and Health Informatics. DOI: 10.1109/JBHI.2022.3156166.",MDADP: A Webserver Integrating Database and Prediction Tools for Microbe-Disease Associations,10.1109/JBHI.2022.3156166,IEEE Xplore,9
MicrobiomeKG (2026),Host-Microbiome Integration,RDF + Biolink Model,"Moderate (Biolink, GO, ChEBI)",~25K-50K nodes,"Centrality analysis, Neural scoring, Embeddings",High,"Li J et al., 2026","Li J, Bu E, Lian A, Li Y, Tao C.. (2026). ""Polarity-Aware Knowledge Graph Reveals Diet-Microbiome-Health Mechanisms with Relevance to Muscle, Immune and Metabolic Aging"". pubmed. DOI: 10.21203/rs.3.rs-8771108/v1.","Polarity-Aware Knowledge Graph Reveals Diet-Microbiome-Health Mechanisms with Relevance to Muscle, I...",10.21203/rs.3.rs-8771108/v1,pubmed,9
AMR-BRIDGE (2024),AMR Prediction & Gene Discovery,KG Embeddings (Translational),"High (CARD, DrugBank, KEGG)",~75K-150K nodes,"TransE/RotatE embeddings, Link prediction",Moderate,"Lara et al., 2024","R. A. D. Santos; G. A. Solano; Z. B. Lara. (2024). ""A Web-Based Network Analysis Tool for the Metaganomic Analysis of Resistomes"". 2024 15th International Conference on Information, Intelligence, Systems & Applications (IISA). DOI: 10.1109/IISA62523.2024.10786654.",A Web-Based Network Analysis Tool for the Metaganomic Analysis of Resistomes,10.1109/IISA62523.2024.10786654,IEEE Xplore,8
KG-Microbe (2025),Modular Microbial Knowledge Graph,RDF Modular (OBO Compliant),"High (OBO Foundry: NCBITaxon, GO, ChEBI, UBERON)",~100K-500K nodes,"Structural queries, Ontology reasoning, SPARQL",High,"Godbold G et al., 2025","Godbold G, Proescher J, Gaudet P.. (2025). ""New and revised gene ontology biological process terms describe multiorganism interactions critical for understanding microbial pathogenesis and sequences of concern"". pubmed. DOI: 10.1186/s13326-025-00323-8.",New and revised gene ontology biological process terms describe multiorganism interactions critical ...,10.1186/s13326-025-00323-8,pubmed,4
Diet-Env KG (MINERVA-type) (2018),Diet-Environment-Disease,Property Graph (Labeled),Moderate (Custom schemas),~40K-80K nodes,"Network exploration, Path analysis, Visualization",Moderate,"Bastola et al., 2018","S. Chandrababu; D. R. Bastola. (2018). ""Comparative Analysis of Graph and Relational Databases using HerbMicrobeDB"". 2018 IEEE International Conference on Healthcare Informatics Workshop (ICHI-W). DOI: 10.1109/ICHI-W.2018.00010.",Comparative Analysis of Graph and Relational Databases using HerbMicrobeDB,10.1109/ICHI-W.2018.00010,IEEE Xplore,8
AMR-GNN (2025),Genomic AMR Classification,Multi-modal GNN (Heterogeneous),"High (CARD, KEGG, UniProt)",~150K-500K nodes,"R-GCN, GAT, Multi-task GNN, Attention mechanisms",Moderate,"Aamer Naafey et al., 2025","Aamer Naafey, Asim Muhammad Nabeel, Vollmer Sebastian, Dengel Andreas. (2025). ""An Explainable Knowledge Graph-Driven Approach to Decipher the Link Between Brain Disorders and the Gut Microbiome"". bioRxiv/medRxiv. DOI: 10.64898/2025.12.11.693657.",An Explainable Knowledge Graph-Driven Approach to Decipher the Link Between Brain Disorders and the ...,10.64898/2025.12.11.693657,bioRxiv,10
